[
  {
    "id": "regular",
    "schemaVersion": 1,
    "displayKey": "customer.regular",
    "active": true,
    "status": "candidate",
    "groupSize": 1,
    "patienceSec": 100,
    "tipMultiplier": 1.0,
    "orderSequence": ["drink", "skewer", "skewer", "skewer"]
  },
  {
    "id": "solo",
    "schemaVersion": 1,
    "displayKey": "customer.solo",
    "active": true,
    "status": "candidate",
    "groupSize": 1,
    "patienceSec": 60,
    "tipMultiplier": 1.0,
    "orderSequence": ["skewer"]
  },
  {
    "id": "office",
    "schemaVersion": 1,
    "displayKey": "customer.office",
    "active": true,
    "status": "candidate",
    "groupSize": 2,
    "patienceSec": 60,
    "tipMultiplier": 1.0,
    "orderSequence": ["drink", "drink", "skewer", "skewer"]
  },
  {
    "id": "commuter",
    "schemaVersion": 1,
    "displayKey": "customer.commuter",
    "active": true,
    "status": "candidate",
    "groupSize": 1,
    "patienceSec": 60,
    "tipMultiplier": 1.0,
    "orderSequence": ["drink", "skewer"]
  },
  {
    "id": "blogger",
    "schemaVersion": 1,
    "displayKey": "customer.blogger",
    "active": true,
    "status": "candidate",
    "groupSize": 1,
    "patienceSec": 80,
    "tipMultiplier": 0.9,
    "orderSequence": ["skewer"]
  },
  {
    "id": "couple",
    "schemaVersion": 1,
    "displayKey": "customer.couple",
    "active": true,
    "status": "candidate",
    "groupSize": 2,
    "patienceSec": 120,
    "tipMultiplier": 1.2,
    "orderSequence": ["skewer"]
  }
]
